{
  "schemaVersion": "1.0",
  "health": {
    "status": "error",
    "lastSuccessfulAt": "2026-10-23T06:31:53.128Z",
    "lastAttemptAt": "2026-10-24T16:38:21.471Z",
    "consecutiveFailures": 1,
    "message": "Kimi pricing failed for https://platform.kimi.com/docs/pricing/chat; RSC: Error: Kimi RSC is missing its rows table; markdown: Error: Kimi pricing page is missing its rows table"
  },
  "id": "moonshot-cn",
  "name": "Kimi China",
  "displayNames": {
    "zh-CN": "月之暗面",
    "en": "Moonshot AI"
  },
  "ownedBy": "moonshot",
  "baseUrls": {
    "openai": "https://api.moonshot.cn/v1"
  },
  "models": [
    {
      "id": "kimi-k3",
      "name": "Kimi K3",
      "aliases": [],
      "capabilities": {
        "thinking": true,
        "thinkingModes": [
          "thinking"
        ],
        "reasoningEfforts": [
          "low",
          "high",
          "max"
        ],
        "dynamicTools": true,
        "jsonOutput": true,
        "toolCalls": true,
        "inputModalities": [
          "text",
          "image",
          "video"
        ],
        "outputModalities": [
          "text"
        ],
        "supportedParameters": [
          "reasoning_effort",
          "tool_choice",
          "temperature",
          "top_p",
          "n",
          "presence_penalty",
          "frequency_penalty"
        ]
      },
      "limits": {
        "contextTokens": 1048576,
        "maxOutputTokens": 1048576
      },
      "prices": [
        {
          "market": "china",
          "currency": "CNY",
          "unit": "1M_tokens",
          "rateType": "standard",
          "input": {
            "cacheHit": 2,
            "explicitCacheCreation": 20,
            "explicitCacheCreation1h": 40,
            "standard": 20
          },
          "output": 100,
          "sourceUrl": "https://platform.kimi.com/docs/pricing/chat",
          "validFrom": "2026-09-20T01:50:47.409Z"
        }
      ],
      "priceHistory": [
        {
          "market": "china",
          "currency": "CNY",
          "unit": "1M_tokens",
          "rateType": "standard",
          "input": {
            "cacheHit": 2,
            "standard": 20
          },
          "output": 100,
          "sourceUrl": "https://platform.kimi.com/docs/pricing/chat",
          "validFrom": "2026-07-22T05:31:27.415Z",
          "validTo": "2026-09-20T01:50:47.409Z"
        }
      ]
    },
    {
      "id": "kimi-k2.7-code",
      "name": "Kimi K2.7 Code",
      "aliases": [],
      "capabilities": {
        "thinking": true,
        "thinkingModes": [
          "thinking"
        ],
        "jsonOutput": true,
        "toolCalls": true,
        "inputModalities": [
          "text",
          "image",
          "video"
        ],
        "outputModalities": [
          "text"
        ],
        "supportedParameters": [
          "thinking",
          "tool_choice",
          "temperature",
          "top_p",
          "n",
          "presence_penalty",
          "frequency_penalty"
        ]
      },
      "limits": {
        "contextTokens": 262144
      },
      "prices": [
        {
          "market": "china",
          "currency": "CNY",
          "unit": "1M_tokens",
          "rateType": "standard",
          "input": {
            "cacheHit": 1.3,
            "standard": 6.5
          },
          "output": 27,
          "sourceUrl": "https://platform.kimi.com/docs/pricing/chat",
          "validFrom": "2026-07-22T05:31:27.415Z"
        }
      ]
    },
    {
      "id": "kimi-k2.7-code-highspeed",
      "name": "Kimi K2.7 Code HighSpeed",
      "aliases": [],
      "capabilities": {
        "thinking": true,
        "thinkingModes": [
          "thinking"
        ],
        "jsonOutput": true,
        "toolCalls": true,
        "inputModalities": [
          "text",
          "image",
          "video"
        ],
        "outputModalities": [
          "text"
        ],
        "supportedParameters": [
          "thinking",
          "tool_choice",
          "temperature",
          "top_p",
          "n",
          "presence_penalty",
          "frequency_penalty"
        ]
      },
      "limits": {
        "contextTokens": 262144
      },
      "prices": [
        {
          "market": "china",
          "currency": "CNY",
          "unit": "1M_tokens",
          "rateType": "standard",
          "input": {
            "cacheHit": 2.6,
            "standard": 13
          },
          "output": 54,
          "sourceUrl": "https://platform.kimi.com/docs/pricing/chat",
          "validFrom": "2026-07-22T05:31:27.415Z"
        }
      ]
    },
    {
      "id": "kimi-k2.6",
      "name": "Kimi K2.6",
      "aliases": [],
      "capabilities": {
        "thinking": true,
        "thinkingModes": [
          "thinking",
          "non-thinking"
        ],
        "jsonOutput": true,
        "toolCalls": true,
        "inputModalities": [
          "text",
          "image",
          "video"
        ],
        "outputModalities": [
          "text"
        ],
        "supportedParameters": [
          "thinking",
          "tool_choice",
          "temperature",
          "top_p",
          "n",
          "presence_penalty",
          "frequency_penalty"
        ]
      },
      "limits": {
        "contextTokens": 262144,
        "maxOutputTokens": 262144
      },
      "prices": [
        {
          "market": "china",
          "currency": "CNY",
          "unit": "1M_tokens",
          "rateType": "standard",
          "input": {
            "cacheHit": 1.1,
            "standard": 6.5
          },
          "output": 27,
          "sourceUrl": "https://platform.kimi.com/docs/pricing/chat",
          "validFrom": "2026-07-22T05:31:27.415Z"
        }
      ]
    }
  ],
  "sources": [
    {
      "url": "https://platform.kimi.com/docs/pricing/chat",
      "kind": "pricing",
      "locale": "zh-CN",
      "currency": "CNY",
      "retrievedAt": "2026-09-20T01:50:43.642Z",
      "contentHash": "sha256:333d08d430437054b588001e572ce3eee545d5cec5c3b08db0047df0f51375a3"
    },
    {
      "url": "https://platform.kimi.com/docs/api/models-overview",
      "kind": "model-metadata",
      "locale": "zh-CN",
      "retrievedAt": "2026-10-23T06:31:53.128Z",
      "contentHash": "sha256:b2b4a931a9e5de3bb90bfeb2b70831be769a6d47975e6e2ca5e628726e0d28e0"
    },
    {
      "url": "https://platform.kimi.com/docs/guide/troubleshooting#kimi",
      "kind": "model-metadata",
      "locale": "zh-CN",
      "retrievedAt": "2026-10-23T06:31:53.128Z",
      "contentHash": "sha256:708503c3e27479183272f7d8bcdd6d5c6e0b4d22875bc3ddfedbbbe0b7d92bbf"
    }
  ]
}
