{
  "schemaVersion": "1.0",
  "health": {
    "status": "error",
    "lastSuccessfulAt": "2026-10-23T06:31:53.138Z",
    "lastAttemptAt": "2026-10-28T06:53:22.164Z",
    "consecutiveFailures": 1,
    "message": "Kimi pricing failed for https://platform.kimi.ai/docs/pricing/chat; RSC: Error: Kimi RSC is missing its rows table; markdown: Error: Kimi pricing page is missing its rows table"
  },
  "id": "moonshot-intl",
  "name": "Kimi International",
  "displayNames": {
    "zh-CN": "月之暗面",
    "en": "Moonshot AI"
  },
  "ownedBy": "moonshot",
  "baseUrls": {
    "openai": "https://api.moonshot.ai/v1"
  },
  "models": [
    {
      "id": "kimi-k3",
      "name": "Kimi K3",
      "aliases": [],
      "capabilities": {
        "thinking": true,
        "thinkingModes": [
          "thinking"
        ],
        "reasoningEfforts": [
          "low",
          "high",
          "max"
        ],
        "dynamicTools": true,
        "jsonOutput": true,
        "toolCalls": true,
        "inputModalities": [
          "text",
          "image",
          "video"
        ],
        "outputModalities": [
          "text"
        ],
        "supportedParameters": [
          "reasoning_effort",
          "tool_choice",
          "temperature",
          "top_p",
          "n",
          "presence_penalty",
          "frequency_penalty"
        ]
      },
      "limits": {
        "contextTokens": 1048576,
        "maxOutputTokens": 1048576
      },
      "prices": [
        {
          "market": "international",
          "currency": "USD",
          "unit": "1M_tokens",
          "rateType": "standard",
          "input": {
            "cacheHit": 0.3,
            "explicitCacheCreation": 3,
            "explicitCacheCreation1h": 6,
            "standard": 3
          },
          "output": 15,
          "sourceUrl": "https://platform.kimi.ai/docs/pricing/chat",
          "validFrom": "2026-09-20T01:50:44.887Z"
        }
      ],
      "priceHistory": [
        {
          "market": "international",
          "currency": "USD",
          "unit": "1M_tokens",
          "rateType": "standard",
          "input": {
            "cacheHit": 0.3,
            "standard": 3
          },
          "output": 15,
          "sourceUrl": "https://platform.kimi.ai/docs/pricing/chat",
          "validFrom": "2026-07-23T09:12:31.262Z",
          "validTo": "2026-09-20T01:50:44.887Z"
        }
      ]
    },
    {
      "id": "kimi-k2.7-code",
      "name": "Kimi K2.7 Code",
      "aliases": [],
      "capabilities": {
        "thinking": true,
        "thinkingModes": [
          "thinking"
        ],
        "jsonOutput": true,
        "toolCalls": true,
        "inputModalities": [
          "text",
          "image",
          "video"
        ],
        "outputModalities": [
          "text"
        ],
        "supportedParameters": [
          "thinking",
          "tool_choice",
          "temperature",
          "top_p",
          "n",
          "presence_penalty",
          "frequency_penalty"
        ]
      },
      "limits": {
        "contextTokens": 262144
      },
      "prices": [
        {
          "market": "international",
          "currency": "USD",
          "unit": "1M_tokens",
          "rateType": "standard",
          "input": {
            "cacheHit": 0.19,
            "standard": 0.95
          },
          "output": 4,
          "sourceUrl": "https://platform.kimi.ai/docs/pricing/chat",
          "validFrom": "2026-07-23T09:12:31.262Z"
        }
      ]
    },
    {
      "id": "kimi-k2.7-code-highspeed",
      "name": "Kimi K2.7 Code HighSpeed",
      "aliases": [],
      "capabilities": {
        "thinking": true,
        "thinkingModes": [
          "thinking"
        ],
        "jsonOutput": true,
        "toolCalls": true,
        "inputModalities": [
          "text",
          "image",
          "video"
        ],
        "outputModalities": [
          "text"
        ],
        "supportedParameters": [
          "thinking",
          "tool_choice",
          "temperature",
          "top_p",
          "n",
          "presence_penalty",
          "frequency_penalty"
        ]
      },
      "limits": {
        "contextTokens": 262144
      },
      "prices": [
        {
          "market": "international",
          "currency": "USD",
          "unit": "1M_tokens",
          "rateType": "standard",
          "input": {
            "cacheHit": 0.38,
            "standard": 1.9
          },
          "output": 8,
          "sourceUrl": "https://platform.kimi.ai/docs/pricing/chat",
          "validFrom": "2026-07-23T09:12:31.262Z"
        }
      ]
    },
    {
      "id": "kimi-k2.6",
      "name": "Kimi K2.6",
      "aliases": [],
      "capabilities": {
        "thinking": true,
        "thinkingModes": [
          "thinking",
          "non-thinking"
        ],
        "jsonOutput": true,
        "toolCalls": true,
        "inputModalities": [
          "text",
          "image",
          "video"
        ],
        "outputModalities": [
          "text"
        ],
        "supportedParameters": [
          "thinking",
          "tool_choice",
          "temperature",
          "top_p",
          "n",
          "presence_penalty",
          "frequency_penalty"
        ]
      },
      "limits": {
        "contextTokens": 262144,
        "maxOutputTokens": 262144
      },
      "prices": [
        {
          "market": "international",
          "currency": "USD",
          "unit": "1M_tokens",
          "rateType": "standard",
          "input": {
            "cacheHit": 0.16,
            "standard": 0.95
          },
          "output": 4,
          "sourceUrl": "https://platform.kimi.ai/docs/pricing/chat",
          "validFrom": "2026-07-23T09:12:31.262Z"
        }
      ]
    }
  ],
  "sources": [
    {
      "url": "https://platform.kimi.ai/docs/pricing/chat",
      "kind": "pricing",
      "locale": "en",
      "currency": "USD",
      "retrievedAt": "2026-09-20T01:50:43.648Z",
      "contentHash": "sha256:2c24e0a4bc93d88e891a8c1720bc4fad24816b70e54ecd7396abf9dfc6a8914f"
    },
    {
      "url": "https://platform.kimi.ai/docs/api/models-overview",
      "kind": "model-metadata",
      "locale": "en",
      "retrievedAt": "2026-10-23T06:31:53.138Z",
      "contentHash": "sha256:2a374fd567d14cb4a954033c0409ec473608535944fcd7c64c56f71a21882534"
    },
    {
      "url": "https://platform.kimi.ai/docs/guide/troubleshooting#kimi",
      "kind": "model-metadata",
      "locale": "en",
      "retrievedAt": "2026-10-23T06:31:53.138Z",
      "contentHash": "sha256:3aeae1c04812c4570473b5cd57491e07d2b7f24deda1a6ad1b718ca0627e44a5"
    }
  ]
}
